Fase 4;DE-VD;63;883460567R;POIGNEE ARTICULATION;Pilotada;MARTUR;ROMANIA;286023-03;;0;B. Couture;N/A;PLDA;POE;;;;;;;;PLDA
Fase 4;DE-VD;63;883463016R;POIGNEE ARTICULATION;Pilotada;MARTUR;ROMANIA;286023-03;;0;B. Couture;N/A;PLDA;POE;;;;;;;;PLDA
Fase 4;DE-VD;63;884174545R;POIGNEE CDE ARTC DOSSIER D SJ 2EME RNG;Piloto;MARTUR;ROMANIA;286023-03;;0;B. Couture;N/A;PLDA;POE;;;;;;;;PLDA
Fase 4;DE-VD;63;884675058R;POIGNEE CDE ARTC DOSSIER G SJ 2EME RNG;Pilotada;MARTUR;ROMANIA;286023-03;;0;B. Couture;N/A;PLDA;POE;;;;;;;;PLDA
Fase 4;DE-VD;63;873681002R;POIGNEE CDE REHAUSSE SIEGE G;Piloto;MARTUR;ROMANIA;286023-03;;0;B. Couture;N/A;PLDA;POE;;;;;;;;PLDA
Fase 4;DE-VD;63;875D44794R;RENFORT ARMATURE COUSSIN SIEGE AV G;Piloto;MARTUR;ROMANIA;286023-03;;0;B. Couture;N/A;PLDA;POE;;;;;;;;PLDA
Full;DEA-SI;92;233001560R;DEMARREUR;Piloto;SEG AUTOMOTIVE INDIA PRIVATE;INDIA;408599-01-BANGALORE;Georman Eugen-Catalin;0;M. Pineda;Victor Sumnienski;PLDA;POE;;;;;;;;PLDA
Fase 4;DE-VD;63;870698191R;CABLAGE SIEGE CONDUCTEUR;Pilotada;MARTUR;ROMANIA;286023-03;;0;B. Couture;N/A;PLDA;POE;;;;;;;;PLDA
Fase 4;DE-VD;63;8201727227;CARTER SIEGE AV D;Pilotada;MARTUR;ROMANIA;286023-03;;0;B. Couture;N/A;PLDA;POE;;;;;;;;PLDA
Fase 4;DEA-SM;95;2591A5195R;CALCULATEUR BOITIER TELEMATIQUE;Piloto;CONTINENTAL AUTOMOTIVE SYSTEMS, INC;MEXICO;403212-01-NOGALES;ZAHARIA Cristina;0;M. Pineda;Alvaro Cesar Benin;PLDA;POE;;;;;;;;PLDA
Fase 4;DE-VD;63;8201727228;OBTURATEUR CDE INCLINAISON SJ 1ERE RNG;Pilotada;MARTUR;ROMANIA;286023-03;;0;B. Couture;N/A;PLDA;POE;;;;;;;;PLDA
Fase 4;DE-VD;63;8201727226;CARTER SIEGE AV G;Piloto;MARTUR;ROMANIA;286023-03;;0;B. Couture;N/A;PLDA;POE;;;;;;;;PLDA
Fase 4;DE-VD;63;8201727229;OBTURATEUR CDE REHAUSSE SIEGE 1ERE RNG;Pilotada;MARTUR;ROMANIA;286023-03;;0;B. Couture;N/A;PLDA;POE;;;;;;;;PLDA
Fase 4;DE-VD;63;8201727221;DOUILLE APPUI-TETE;Piloto;MARTUR;ROMANIA;286023-03;;0;B. Couture;N/A;PLDA;POE;;;;;;;;PLDA
Fase 4;DEA-MM;M8;100019059R;MOT ASS H5H 452;;VALLADOLLID MOTORES;SPAIN;VALLADOLLID;;0;E. Montoya;;PLDA;POI;;S2008;;;;;;PLDA
Fase 4;DEA-MM;M8;100016023R;MOT ASS H5H 462;;VALLADOLLID MOTORES;SPAIN;VALLADOLLID;;0;E. Montoya;;PLDA;POI;;S2008;;;;;;PLDA
Full;DEA-MM;M2;144601932R;CONDUIT AIR SORTIE TURBOCOMPRESSEUR;Piloto;CONTITECH FLUID AUTOMOT.ROMA;ROMANIA;402535-00-CAREI-ROUMANIE;Albiero Andre;Melanie  HEURTAUX / Lidia ILIE;E. Montoya;??;PLDA;POE;;;;;;;;PLDA
Full;DEA-MM;M2;144606197R;CONDUIT AIR SORTIE ECHANGEUR EQP;Piloto;CIKAUTXO RO RUBBER AND PLAST;ROMANIA;401930-00-CAMPIA TURZII-ROUMANIE;;Elena Alexandra GHITA - AY33924;E. Montoya;Paulo Locatelli;PLDA;POE;;;;;;;;PLDA
Full;DEA-MM;M4;144989505R;TUYAU EAU SORTIE TURBOCOMPRESSEUR;Piloto;HBA HUTCHINSON BRASIL AUTOMO;BRAZIL;620605-00-EXTREMA;;Jo伋 Vicente - LB00627;E. Montoya;Seko Sergio lb14383;PLDA;POE;;S1943;;;;;;PLDA
Full;DEA-MM;M2;165554519R;CONDUIT AIR AMONT FILTRE;Piloto;NOVARES DO BRASIL IND. AUTOM;BRAZIL;119742-00-PIRITUBA SP-BRESIL;;Karine SUZUKI NA03129;E. Montoya;Alexandre Bilecki;PLDA;POE;;S1942;;;;;;PLDA
Full;DEA-MM;M4;213073374R;TUYAU EAU ENTREE ECHANGEUR EAU HUILE;Piloto;HBA HUTCHINSON BRASIL AUTOMO;BRAZIL;620605-00-EXTREMA;;Jo伋 Vicente - LB00627;E. Montoya;Seko Sergio lb14383;PLDA;POE;;S1943;;;;;;PLDA
Full;DEA-MM;M4;213083594R;TUYAU EAU SORTIE ECHANGEUR EAU HUILE;Piloto;HBA HUTCHINSON BRASIL AUTOMO;BRAZIL;620605-00-EXTREMA;;Laura Dorina IONESCU - AY29087;E. Montoya;Seko Sergio lb14383;PLDA;POE;;S1943;;;;;;PLDA
Full;DEA-MM;M2;223200867R;TUYAU DPRS POMPE VIDE - ELECTROVANNE;Piloto;HBA HUTCHINSON BRASIL AUTOMO;BRAZIL;620605-00-EXTREMA;;Jo伋 Vicente - LB00627;E. Montoya;Seko Sergio lb14383;PLDA;POE;;S1943;;;;;;PLDA
Full;DEA-MM;M5;118294850R;TUYAUTERIE VAPEUR HUILE SORTIE DECANTEUR;Piloto;NOBEL AUTOMOTIVE ROMANIA SRL;ROMANIA;265515-01-CAMPULUNG MUSCEL;;Laura Ionescu AY29087;E. Montoya;Paulo Locatelli;PLDA;POE;;S1946;;;;;;PLDA
Fase 4;DE-VD;62;806708865R;POIGNEE INT PORTE AV D;Pilotada;SIMOLDES PLASTICOS DO BRASIL;BRAZIL;620679-00-SAO JOSE DOS PINHAIS;;0;J. Gomez;;PLDA;POE;;;;;;;;PLDA
Fase 4;DE-VD;62;806716274R;POIGNEE INT PORTE AV G;Pilotada;SIMOLDES PLASTICOS DO BRASIL;BRAZIL;620679-00-SAO JOSE DOS PINHAIS;;0;J. Gomez;;PLDA;POE;;;;;;;;PLDA
Fase 4;DE-VD;62;809082461R;MEDAILLON GARNITURE PANNEAU PORTE AV D;Pilotada;SIMOLDES PLASTICOS DO BRASIL;BRAZIL;620679-00-SAO JOSE DOS PINHAIS;;0;J. Gomez;;PLDA;POE;;;;;;;;PLDA
Fase 4;DE-VD;62;809083144R;MEDAILLON GARNITURE PANNEAU PORTE AV D;Pilotada;SIMOLDES PLASTICOS DO BRASIL;BRAZIL;620679-00-SAO JOSE DOS PINHAIS;;0;J. Gomez;;PLDA;POE;;;;;;;;PLDA
Fase 4;DE-VD;62;809099644R;MEDAILLON GARNITURE PANNEAU PORTE AV G;Pilotada;SIMOLDES PLASTICOS DO BRASIL;BRAZIL;620679-00-SAO JOSE DOS PINHAIS;;0;J. Gomez;;PLDA;POE;;;;;;;;PLDA
Fase 4;DE-VD;62;809099915R;MEDAILLON GARNITURE PANNEAU PORTE AV G;Pilotada;SIMOLDES PLASTICOS DO BRASIL;BRAZIL;620679-00-SAO JOSE DOS PINHAIS;;0;J. Gomez;;PLDA;POE;;;;;;;;PLDA
Fase 4;DE-VD;62;809100835R;BAC PORTE AV D;Pilotada;SIMOLDES PLASTICOS DO BRASIL;BRAZIL;620679-00-SAO JOSE DOS PINHAIS;;0;J. Gomez;;PLDA;POE;;;;;;;;PLDA
Fase 4;DE-VD;62;809116688R;BAC PORTE AV G;Pilotada;SIMOLDES PLASTICOS DO BRASIL;BRAZIL;620679-00-SAO JOSE DOS PINHAIS;;0;J. Gomez;;PLDA;POE;;;;;;;;PLDA
Fase 4;DE-VD;62;809402873R;ACCOUDOIR PORTE AV D;Pilotada;SIMOLDES PLASTICOS DO BRASIL;BRAZIL;620679-00-SAO JOSE DOS PINHAIS;;0;J. Gomez;;PLDA;POE;;;;;;;;PLDA
Fase 4;DE-VD;62;809415645R;ACCOUDOIR PORTE AV G;Pilotada;SIMOLDES PLASTICOS DO BRASIL;BRAZIL;620679-00-SAO JOSE DOS PINHAIS;;0;J. Gomez;;PLDA;POE;;;;;;;;PLDA
Fase 4;DE-VD;62;826748552R;RENFORT POIGNEE TIRAGE D;Pilotada;SIMOLDES PLASTICOS DO BRASIL;BRAZIL;620679-00-SAO JOSE DOS PINHAIS;;0;J. Gomez;;PLDA;POE;;;;;;;;PLDA
Fase 4;DE-VD;62;826754919R;RENFORT POIGNEE TIRAGE G;Pilotada;SIMOLDES PLASTICOS DO BRASIL;BRAZIL;620679-00-SAO JOSE DOS PINHAIS;;0;J. Gomez;;PLDA;POE;;;;;;;;PLDA
Fase 4;DE-VD;62;829102588R;BAC PORTE AR D;Pilotada;SIMOLDES PLASTICOS DO BRASIL;BRAZIL;620679-00-SAO JOSE DOS PINHAIS;;0;J. Gomez;;PLDA;POE;;;;;;;;PLDA
Fase 4;DE-VD;62;829117078R;BAC PORTE AR G;Pilotada;SIMOLDES PLASTICOS DO BRASIL;BRAZIL;620679-00-SAO JOSE DOS PINHAIS;;0;J. Gomez;;PLDA;POE;;;;;;;;PLDA
Fase 4;DE-VD;62;829409491R;ACCOUDOIR PORTE AR D;Pilotada;SIMOLDES PLASTICOS DO BRASIL;BRAZIL;620679-00-SAO JOSE DOS PINHAIS;;0;J. Gomez;;PLDA;POE;;;;;;;;PLDA
Fase 4;DE-VD;62;829412582R;ACCOUDOIR PORTE AR G;Piloto;SIMOLDES PLASTICOS DO BRASIL;BRAZIL;620679-00-SAO JOSE DOS PINHAIS;;0;J. Gomez;;PLDA;POE;;;;;;;;PLDA
Fase 4;DE-VD;63;886020178R;ETRIER APPUI TETE;Piloto;MARTUR;ROMANIA;286023-03;;0;B. Couture;N/A;PLDA;POE;;;;;;;;PLDA
Fase 4;DE-VD;63;886027039R;ETRIER APPUI TETE;Piloto; TESCA DINIZ TURKEY TEKSTIL VE KOLTU;TURKEY;297510-01-BURSA-TURQUIE;;0;B. Couture;??;PLDA;POE;;;;;;;;PLDA
;;;873333523R;;;;;;;;;;;;;;;;;;;PLDA
